[
  {
    "query_id": "personal-q01",
    "relevant_chunk_ids": [
      "doc_75c1cbf96e88ce7d946b678a426f5e163e66da6d179cec74201c88690727885f_chunk_bcbc850a334b4047"
    ],
    "annotator": "REPLACE_WITH_ANNOTATOR",
    "annotated_at": "REPLACE_WITH_ISO8601_TIMESTAMP",
    "source": "derived",
    "decision_note": "REVIEW_REQUIRED: verify relevant_chunk_ids against the current corpus",
    "corpus_checksum": "sha256:80170ea3cd3b1adb2b4ecc71918a9460a87050a6cfbcf22fa639611e8dded919",
    "parser_version": "mixed",
    "chunking_version": "paragraph-pack-v2",
    "parser_versions": [
      "csv-v1",
      "email-v1",
      "html-v4",
      "json-v1",
      "jsonl-v1",
      "plain-text-v1",
      "rtf-v1",
      "xml-v1",
      "yaml-v1"
    ]
  },
  {
    "query_id": "personal-q02",
    "relevant_chunk_ids": [
      "doc_75c1cbf96e88ce7d946b678a426f5e163e66da6d179cec74201c88690727885f_chunk_6935e12a985c44de"
    ],
    "annotator": "REPLACE_WITH_ANNOTATOR",
    "annotated_at": "REPLACE_WITH_ISO8601_TIMESTAMP",
    "source": "derived",
    "decision_note": "REVIEW_REQUIRED: verify relevant_chunk_ids against the current corpus",
    "corpus_checksum": "sha256:80170ea3cd3b1adb2b4ecc71918a9460a87050a6cfbcf22fa639611e8dded919",
    "parser_version": "mixed",
    "chunking_version": "paragraph-pack-v2",
    "parser_versions": [
      "csv-v1",
      "email-v1",
      "html-v4",
      "json-v1",
      "jsonl-v1",
      "plain-text-v1",
      "rtf-v1",
      "xml-v1",
      "yaml-v1"
    ]
  },
  {
    "query_id": "personal-q03",
    "relevant_chunk_ids": [
      "doc_75c1cbf96e88ce7d946b678a426f5e163e66da6d179cec74201c88690727885f_chunk_31cbe8b610fae902"
    ],
    "annotator": "REPLACE_WITH_ANNOTATOR",
    "annotated_at": "REPLACE_WITH_ISO8601_TIMESTAMP",
    "source": "derived",
    "decision_note": "REVIEW_REQUIRED: verify relevant_chunk_ids against the current corpus",
    "corpus_checksum": "sha256:80170ea3cd3b1adb2b4ecc71918a9460a87050a6cfbcf22fa639611e8dded919",
    "parser_version": "mixed",
    "chunking_version": "paragraph-pack-v2",
    "parser_versions": [
      "csv-v1",
      "email-v1",
      "html-v4",
      "json-v1",
      "jsonl-v1",
      "plain-text-v1",
      "rtf-v1",
      "xml-v1",
      "yaml-v1"
    ]
  },
  {
    "query_id": "personal-q04",
    "relevant_chunk_ids": [
      "doc_75c1cbf96e88ce7d946b678a426f5e163e66da6d179cec74201c88690727885f_chunk_6c70852ec418ded0"
    ],
    "annotator": "REPLACE_WITH_ANNOTATOR",
    "annotated_at": "REPLACE_WITH_ISO8601_TIMESTAMP",
    "source": "derived",
    "decision_note": "REVIEW_REQUIRED: verify relevant_chunk_ids against the current corpus",
    "corpus_checksum": "sha256:80170ea3cd3b1adb2b4ecc71918a9460a87050a6cfbcf22fa639611e8dded919",
    "parser_version": "mixed",
    "chunking_version": "paragraph-pack-v2",
    "parser_versions": [
      "csv-v1",
      "email-v1",
      "html-v4",
      "json-v1",
      "jsonl-v1",
      "plain-text-v1",
      "rtf-v1",
      "xml-v1",
      "yaml-v1"
    ]
  },
  {
    "query_id": "personal-q05",
    "relevant_chunk_ids": [
      "doc_75c1cbf96e88ce7d946b678a426f5e163e66da6d179cec74201c88690727885f_chunk_83364d8dbd592026"
    ],
    "annotator": "REPLACE_WITH_ANNOTATOR",
    "annotated_at": "REPLACE_WITH_ISO8601_TIMESTAMP",
    "source": "derived",
    "decision_note": "REVIEW_REQUIRED: verify relevant_chunk_ids against the current corpus",
    "corpus_checksum": "sha256:80170ea3cd3b1adb2b4ecc71918a9460a87050a6cfbcf22fa639611e8dded919",
    "parser_version": "mixed",
    "chunking_version": "paragraph-pack-v2",
    "parser_versions": [
      "csv-v1",
      "email-v1",
      "html-v4",
      "json-v1",
      "jsonl-v1",
      "plain-text-v1",
      "rtf-v1",
      "xml-v1",
      "yaml-v1"
    ]
  },
  {
    "query_id": "personal-q06",
    "relevant_chunk_ids": [
      "doc_75c1cbf96e88ce7d946b678a426f5e163e66da6d179cec74201c88690727885f_chunk_017179d604e4218e"
    ],
    "annotator": "REPLACE_WITH_ANNOTATOR",
    "annotated_at": "REPLACE_WITH_ISO8601_TIMESTAMP",
    "source": "derived",
    "decision_note": "REVIEW_REQUIRED: verify relevant_chunk_ids against the current corpus",
    "corpus_checksum": "sha256:80170ea3cd3b1adb2b4ecc71918a9460a87050a6cfbcf22fa639611e8dded919",
    "parser_version": "mixed",
    "chunking_version": "paragraph-pack-v2",
    "parser_versions": [
      "csv-v1",
      "email-v1",
      "html-v4",
      "json-v1",
      "jsonl-v1",
      "plain-text-v1",
      "rtf-v1",
      "xml-v1",
      "yaml-v1"
    ]
  },
  {
    "query_id": "personal-q07",
    "relevant_chunk_ids": [
      "doc_75c1cbf96e88ce7d946b678a426f5e163e66da6d179cec74201c88690727885f_chunk_4922d38f3dc78591"
    ],
    "annotator": "REPLACE_WITH_ANNOTATOR",
    "annotated_at": "REPLACE_WITH_ISO8601_TIMESTAMP",
    "source": "derived",
    "decision_note": "REVIEW_REQUIRED: verify relevant_chunk_ids against the current corpus",
    "corpus_checksum": "sha256:80170ea3cd3b1adb2b4ecc71918a9460a87050a6cfbcf22fa639611e8dded919",
    "parser_version": "mixed",
    "chunking_version": "paragraph-pack-v2",
    "parser_versions": [
      "csv-v1",
      "email-v1",
      "html-v4",
      "json-v1",
      "jsonl-v1",
      "plain-text-v1",
      "rtf-v1",
      "xml-v1",
      "yaml-v1"
    ]
  },
  {
    "query_id": "personal-q08",
    "relevant_chunk_ids": [
      "doc_75c1cbf96e88ce7d946b678a426f5e163e66da6d179cec74201c88690727885f_chunk_069e8f04d9d872f8"
    ],
    "annotator": "REPLACE_WITH_ANNOTATOR",
    "annotated_at": "REPLACE_WITH_ISO8601_TIMESTAMP",
    "source": "derived",
    "decision_note": "REVIEW_REQUIRED: verify relevant_chunk_ids against the current corpus",
    "corpus_checksum": "sha256:80170ea3cd3b1adb2b4ecc71918a9460a87050a6cfbcf22fa639611e8dded919",
    "parser_version": "mixed",
    "chunking_version": "paragraph-pack-v2",
    "parser_versions": [
      "csv-v1",
      "email-v1",
      "html-v4",
      "json-v1",
      "jsonl-v1",
      "plain-text-v1",
      "rtf-v1",
      "xml-v1",
      "yaml-v1"
    ]
  },
  {
    "query_id": "personal-q09",
    "relevant_chunk_ids": [
      "doc_75c1cbf96e88ce7d946b678a426f5e163e66da6d179cec74201c88690727885f_chunk_255b34ab59d3ad5d"
    ],
    "annotator": "REPLACE_WITH_ANNOTATOR",
    "annotated_at": "REPLACE_WITH_ISO8601_TIMESTAMP",
    "source": "derived",
    "decision_note": "REVIEW_REQUIRED: verify relevant_chunk_ids against the current corpus",
    "corpus_checksum": "sha256:80170ea3cd3b1adb2b4ecc71918a9460a87050a6cfbcf22fa639611e8dded919",
    "parser_version": "mixed",
    "chunking_version": "paragraph-pack-v2",
    "parser_versions": [
      "csv-v1",
      "email-v1",
      "html-v4",
      "json-v1",
      "jsonl-v1",
      "plain-text-v1",
      "rtf-v1",
      "xml-v1",
      "yaml-v1"
    ]
  },
  {
    "query_id": "personal-q10",
    "relevant_chunk_ids": [
      "doc_75c1cbf96e88ce7d946b678a426f5e163e66da6d179cec74201c88690727885f_chunk_aa5144ce2a3d03a0"
    ],
    "annotator": "REPLACE_WITH_ANNOTATOR",
    "annotated_at": "REPLACE_WITH_ISO8601_TIMESTAMP",
    "source": "derived",
    "decision_note": "REVIEW_REQUIRED: verify relevant_chunk_ids against the current corpus",
    "corpus_checksum": "sha256:80170ea3cd3b1adb2b4ecc71918a9460a87050a6cfbcf22fa639611e8dded919",
    "parser_version": "mixed",
    "chunking_version": "paragraph-pack-v2",
    "parser_versions": [
      "csv-v1",
      "email-v1",
      "html-v4",
      "json-v1",
      "jsonl-v1",
      "plain-text-v1",
      "rtf-v1",
      "xml-v1",
      "yaml-v1"
    ]
  },
  {
    "query_id": "personal-q11",
    "relevant_chunk_ids": [
      "doc_75c1cbf96e88ce7d946b678a426f5e163e66da6d179cec74201c88690727885f_chunk_31cbe8b610fae902"
    ],
    "annotator": "REPLACE_WITH_ANNOTATOR",
    "annotated_at": "REPLACE_WITH_ISO8601_TIMESTAMP",
    "source": "derived",
    "decision_note": "REVIEW_REQUIRED: verify relevant_chunk_ids against the current corpus",
    "corpus_checksum": "sha256:80170ea3cd3b1adb2b4ecc71918a9460a87050a6cfbcf22fa639611e8dded919",
    "parser_version": "mixed",
    "chunking_version": "paragraph-pack-v2",
    "parser_versions": [
      "csv-v1",
      "email-v1",
      "html-v4",
      "json-v1",
      "jsonl-v1",
      "plain-text-v1",
      "rtf-v1",
      "xml-v1",
      "yaml-v1"
    ]
  },
  {
    "query_id": "personal-q12",
    "relevant_chunk_ids": [
      "doc_75c1cbf96e88ce7d946b678a426f5e163e66da6d179cec74201c88690727885f_chunk_83364d8dbd592026"
    ],
    "annotator": "REPLACE_WITH_ANNOTATOR",
    "annotated_at": "REPLACE_WITH_ISO8601_TIMESTAMP",
    "source": "derived",
    "decision_note": "REVIEW_REQUIRED: verify relevant_chunk_ids against the current corpus",
    "corpus_checksum": "sha256:80170ea3cd3b1adb2b4ecc71918a9460a87050a6cfbcf22fa639611e8dded919",
    "parser_version": "mixed",
    "chunking_version": "paragraph-pack-v2",
    "parser_versions": [
      "csv-v1",
      "email-v1",
      "html-v4",
      "json-v1",
      "jsonl-v1",
      "plain-text-v1",
      "rtf-v1",
      "xml-v1",
      "yaml-v1"
    ]
  },
  {
    "query_id": "personal-q13",
    "relevant_chunk_ids": [
      "doc_75c1cbf96e88ce7d946b678a426f5e163e66da6d179cec74201c88690727885f_chunk_017179d604e4218e"
    ],
    "annotator": "REPLACE_WITH_ANNOTATOR",
    "annotated_at": "REPLACE_WITH_ISO8601_TIMESTAMP",
    "source": "derived",
    "decision_note": "REVIEW_REQUIRED: verify relevant_chunk_ids against the current corpus",
    "corpus_checksum": "sha256:80170ea3cd3b1adb2b4ecc71918a9460a87050a6cfbcf22fa639611e8dded919",
    "parser_version": "mixed",
    "chunking_version": "paragraph-pack-v2",
    "parser_versions": [
      "csv-v1",
      "email-v1",
      "html-v4",
      "json-v1",
      "jsonl-v1",
      "plain-text-v1",
      "rtf-v1",
      "xml-v1",
      "yaml-v1"
    ]
  },
  {
    "query_id": "personal-q14",
    "relevant_chunk_ids": [
      "doc_75c1cbf96e88ce7d946b678a426f5e163e66da6d179cec74201c88690727885f_chunk_255b34ab59d3ad5d"
    ],